[
  {
    "id": "car-audi-a3-1",
    "type": "car",
    "make": "Audi",
    "model": "A3",
    "engine": "8P · 1.2–1.8 TFSI",
    "yearFrom": 2008,
    "yearTo": 2012,
    "startStop": false,
    "oem": {
      "ahMin": 60,
      "ccaMin": 480,
      "polarity": "L+",
      "caseCode": "L2",
      "techMin": "SMF"
    },
    "include": [
      "s60"
    ],
    "source": "demo",
    "verified": false
  },
  {
    "id": "car-audi-a3-2",
    "type": "car",
    "make": "Audi",
    "model": "A3",
    "engine": "8V · 1.0–1.8 TFSI · start-stop",
    "yearFrom": 2012,
    "yearTo": 2020,
    "startStop": true,
    "oem": {
      "ahMin": 70,
      "ccaMin": 640,
      "polarity": "L+",
      "caseCode": "L3",
      "techMin": "EFB"
    },
    "include": [
      "e70"
    ],
    "source": "demo",
    "verified": false
  },
  {
    "id": "car-audi-a3-3",
    "type": "car",
    "make": "Audi",
    "model": "A3",
    "engine": "8Y · 1.0–2.0 TFSI · start-stop",
    "yearFrom": 2020,
    "yearTo": 2027,
    "startStop": true,
    "oem": {
      "ahMin": 68,
      "ccaMin": 760,
      "polarity": "L+",
      "caseCode": "L3",
      "techMin": "AGM"
    },
    "include": [
      "a68"
    ],
    "source": "demo",
    "verified": false
  },
  {
    "id": "car-audi-a4-1",
    "type": "car",
    "make": "Audi",
    "model": "A4",
    "engine": "B8 · 1.8–3.0 TFSI / TDI",
    "yearFrom": 2008,
    "yearTo": 2015,
    "startStop": false,
    "oem": {
      "ahMin": 77,
      "ccaMin": 680,
      "polarity": "L+",
      "caseCode": "L3",
      "techMin": "SMF"
    },
    "include": [
      "s77"
    ],
    "source": "demo",
    "verified": false
  },
  {
    "id": "car-audi-a4-2",
    "type": "car",
    "make": "Audi",
    "model": "A4",
    "engine": "B9 · 1.4–2.0 TFSI / TDI · start-stop",
    "yearFrom": 2016,
    "yearTo": 2027,
    "startStop": true,
    "oem": {
      "ahMin": 68,
      "ccaMin": 760,
      "polarity": "L+",
      "caseCode": "L3",
      "techMin": "AGM"
    },
    "include": [
      "a68"
    ],
    "source": "demo",
    "verified": false
  },
  {
    "id": "car-audi-a6-1",
    "type": "car",
    "make": "Audi",
    "model": "A6",
    "engine": "C6 · 2.0–2.7 TDI",
    "yearFrom": 2004,
    "yearTo": 2011,
    "startStop": false,
    "oem": {
      "ahMin": 77,
      "ccaMin": 680,
      "polarity": "L+",
      "caseCode": "L3",
      "techMin": "SMF"
    },
    "include": [
      "s77"
    ],
    "source": "demo",
    "verified": false
  },
  {
    "id": "car-audi-a6-2",
    "type": "car",
    "make": "Audi",
    "model": "A6",
    "engine": "C7 · 2.0–3.0 TDI · start-stop",
    "yearFrom": 2011,
    "yearTo": 2018,
    "startStop": true,
    "oem": {
      "ahMin": 68,
      "ccaMin": 760,
      "polarity": "L+",
      "caseCode": "L3",
      "techMin": "AGM"
    },
    "include": [
      "a68"
    ],
    "source": "demo",
    "verified": false
  },
  {
    "id": "car-bmw-3-series-1",
    "type": "car",
    "make": "BMW",
    "model": "3 series",
    "engine": "E90 · 318i–325i",
    "yearFrom": 2005,
    "yearTo": 2011,
    "startStop": false,
    "oem": {
      "ahMin": 77,
      "ccaMin": 680,
      "polarity": "L+",
      "caseCode": "L3",
      "techMin": "SMF"
    },
    "include": [
      "s77"
    ],
    "source": "demo",
    "verified": false
  },
  {
    "id": "car-bmw-3-series-2",
    "type": "car",
    "make": "BMW",
    "model": "3 series",
    "engine": "F30 · 316i–320i · start-stop",
    "yearFrom": 2012,
    "yearTo": 2019,
    "startStop": true,
    "oem": {
      "ahMin": 68,
      "ccaMin": 760,
      "polarity": "L+",
      "caseCode": "L3",
      "techMin": "AGM"
    },
    "include": [
      "a68"
    ],
    "source": "demo",
    "verified": false
  },
  {
    "id": "car-bmw-3-series-3",
    "type": "car",
    "make": "BMW",
    "model": "3 series",
    "engine": "G20 · petrol / diesel · start-stop",
    "yearFrom": 2019,
    "yearTo": 2027,
    "startStop": true,
    "oem": {
      "ahMin": 68,
      "ccaMin": 760,
      "polarity": "L+",
      "caseCode": "L3",
      "techMin": "AGM"
    },
    "include": [
      "a68"
    ],
    "source": "demo",
    "verified": false
  },
  {
    "id": "car-bmw-5-series-1",
    "type": "car",
    "make": "BMW",
    "model": "5 series",
    "engine": "E60 · 520d–530d",
    "yearFrom": 2003,
    "yearTo": 2010,
    "startStop": false,
    "oem": {
      "ahMin": 77,
      "ccaMin": 680,
      "polarity": "L+",
      "caseCode": "L3",
      "techMin": "SMF"
    },
    "include": [
      "s77"
    ],
    "source": "demo",
    "verified": false
  },
  {
    "id": "car-bmw-5-series-2",
    "type": "car",
    "make": "BMW",
    "model": "5 series",
    "engine": "G30 · 520d–540i · start-stop",
    "yearFrom": 2017,
    "yearTo": 2027,
    "startStop": true,
    "oem": {
      "ahMin": 68,
      "ccaMin": 760,
      "polarity": "L+",
      "caseCode": "L3",
      "techMin": "AGM"
    },
    "include": [
      "a68"
    ],
    "source": "demo",
    "verified": false
  },
  {
    "id": "car-bmw-x5-1",
    "type": "car",
    "make": "BMW",
    "model": "X5",
    "engine": "E70 · 3.0d",
    "yearFrom": 2007,
    "yearTo": 2013,
    "startStop": false,
    "oem": {
      "ahMin": 100,
      "ccaMin": 800,
      "polarity": "L+",
      "caseCode": "L5",
      "techMin": "SMF"
    },
    "include": [
      "t100"
    ],
    "source": "demo",
    "verified": false
  },
  {
    "id": "car-bmw-x5-2",
    "type": "car",
    "make": "BMW",
    "model": "X5",
    "engine": "F15–G05 · diesel · start-stop",
    "yearFrom": 2014,
    "yearTo": 2027,
    "startStop": true,
    "oem": {
      "ahMin": 68,
      "ccaMin": 760,
      "polarity": "L+",
      "caseCode": "L3",
      "techMin": "AGM"
    },
    "include": [
      "a68"
    ],
    "source": "demo",
    "verified": false
  },
  {
    "id": "car-citroen-c3-1",
    "type": "car",
    "make": "Citroën",
    "model": "C3",
    "engine": "1.1–1.6",
    "yearFrom": 2003,
    "yearTo": 2009,
    "startStop": false,
    "oem": {
      "ahMin": 44,
      "ccaMin": 360,
      "polarity": "L+",
      "caseCode": "L1",
      "techMin": "SMF"
    },
    "include": [
      "s44"
    ],
    "source": "demo",
    "verified": false
  },
  {
    "id": "car-citroen-c3-2",
    "type": "car",
    "make": "Citroën",
    "model": "C3",
    "engine": "1.2 PureTech · start-stop",
    "yearFrom": 2010,
    "yearTo": 2027,
    "startStop": true,
    "oem": {
      "ahMin": 70,
      "ccaMin": 640,
      "polarity": "L+",
      "caseCode": "L3",
      "techMin": "EFB"
    },
    "include": [
      "e70"
    ],
    "source": "demo",
    "verified": false
  },
  {
    "id": "car-citroen-c4-1",
    "type": "car",
    "make": "Citroën",
    "model": "C4",
    "engine": "1.4–1.6",
    "yearFrom": 2005,
    "yearTo": 2010,
    "startStop": false,
    "oem": {
      "ahMin": 60,
      "ccaMin": 480,
      "polarity": "L+",
      "caseCode": "L2",
      "techMin": "SMF"
    },
    "include": [
      "s60"
    ],
    "source": "demo",
    "verified": false
  },
  {
    "id": "car-citroen-c4-2",
    "type": "car",
    "make": "Citroën",
    "model": "C4",
    "engine": "1.2 PureTech · start-stop",
    "yearFrom": 2011,
    "yearTo": 2027,
    "startStop": true,
    "oem": {
      "ahMin": 70,
      "ccaMin": 640,
      "polarity": "L+",
      "caseCode": "L3",
      "techMin": "EFB"
    },
    "include": [
      "e70"
    ],
    "source": "demo",
    "verified": false
  },
  {
    "id": "car-citroen-berlingo-1",
    "type": "car",
    "make": "Citroën",
    "model": "Berlingo",
    "engine": "1.6 HDi",
    "yearFrom": 2008,
    "yearTo": 2017,
    "startStop": false,
    "oem": {
      "ahMin": 60,
      "ccaMin": 480,
      "polarity": "L+",
      "caseCode": "L2",
      "techMin": "SMF"
    },
    "include": [
      "s60"
    ],
    "source": "demo",
    "verified": false
  },
  {
    "id": "car-citroen-berlingo-2",
    "type": "car",
    "make": "Citroën",
    "model": "Berlingo",
    "engine": "1.5 BlueHDi · start-stop",
    "yearFrom": 2018,
    "yearTo": 2027,
    "startStop": true,
    "oem": {
      "ahMin": 77,
      "ccaMin": 680,
      "polarity": "L+",
      "caseCode": "L3",
      "techMin": "EFB"
    },
    "include": [
      "s77"
    ],
    "source": "demo",
    "verified": false
  },
  {
    "id": "car-fiat-500-1",
    "type": "car",
    "make": "Fiat",
    "model": "500",
    "engine": "1.2",
    "yearFrom": 2008,
    "yearTo": 2020,
    "startStop": false,
    "oem": {
      "ahMin": 44,
      "ccaMin": 360,
      "polarity": "L+",
      "caseCode": "L1",
      "techMin": "SMF"
    },
    "include": [
      "s44"
    ],
    "source": "demo",
    "verified": false
  },
  {
    "id": "car-fiat-500-2",
    "type": "car",
    "make": "Fiat",
    "model": "500",
    "engine": "1.0 Hybrid · start-stop",
    "yearFrom": 2020,
    "yearTo": 2027,
    "startStop": true,
    "oem": {
      "ahMin": 70,
      "ccaMin": 640,
      "polarity": "L+",
      "caseCode": "L3",
      "techMin": "EFB"
    },
    "include": [
      "e70"
    ],
    "source": "demo",
    "verified": false
  },
  {
    "id": "car-fiat-panda-1",
    "type": "car",
    "make": "Fiat",
    "model": "Panda",
    "engine": "1.0–1.2",
    "yearFrom": 2004,
    "yearTo": 2027,
    "startStop": false,
    "oem": {
      "ahMin": 44,
      "ccaMin": 360,
      "polarity": "L+",
      "caseCode": "L1",
      "techMin": "SMF"
    },
    "include": [
      "s44"
    ],
    "source": "demo",
    "verified": false
  },
  {
    "id": "car-fiat-punto-1",
    "type": "car",
    "make": "Fiat",
    "model": "Punto",
    "engine": "1.2–1.4",
    "yearFrom": 2006,
    "yearTo": 2018,
    "startStop": false,
    "oem": {
      "ahMin": 44,
      "ccaMin": 360,
      "polarity": "L+",
      "caseCode": "L1",
      "techMin": "SMF"
    },
    "include": [
      "s44"
    ],
    "source": "demo",
    "verified": false
  },
  {
    "id": "car-fiat-doblo-1",
    "type": "car",
    "make": "Fiat",